{
  "meta": {
    "schemaVersion": "causora.contract.v1",
    "product": "Causora",
    "version": "Day 1 Prototype",
    "dataVersion": "demo-2026.10.04-v4",
    "status": "verified-local-mock",
    "seed": 1042026,
    "notice": "All values are local Day 1 mock data. No live simulation or model call has run."
  },
  "intake": [
    {
      "id": "demand",
      "label": "Historical demand",
      "type": "CSV",
      "detail": "104 weekly observations",
      "size": "3.9 KB",
      "status": "Ready",
      "icon": "trend",
      "path": "/demo/historical_demand.csv"
    },
    {
      "id": "delivery",
      "label": "Supplier delivery history",
      "type": "XLSX",
      "detail": "48 purchase orders",
      "size": "6.6 KB",
      "status": "Ready",
      "icon": "truck",
      "path": "/demo/supplier_delivery_history.xlsx"
    },
    {
      "id": "inventory",
      "label": "Opening inventory",
      "type": "CSV",
      "detail": "1,840 units on hand",
      "size": "0.1 KB",
      "status": "Ready",
      "icon": "box",
      "path": "/demo/opening_inventory.csv"
    },
    {
      "id": "contract",
      "label": "Supplier A agreement",
      "type": "PDF",
      "detail": "Machine-readable · 6 pages",
      "size": "7.5 KB",
      "status": "Matched",
      "icon": "file",
      "path": "/demo/supplier_a_agreement.pdf"
    }
  ],
  "evidence": [
    {
      "id": "EV-014",
      "sourceFile": "supplier_a_agreement.pdf",
      "page": 4,
      "quote": "If written notice is not received at least 60 days before renewal, the agreement automatically renews.",
      "locatorBbox": null,
      "extractedField": "renewal_notice_days",
      "extractedValue": "60 days",
      "matchMethod": "exact",
      "matchScore": 1.0,
      "quoteMatched": true
    },
    {
      "id": "EV-019",
      "sourceFile": "supplier_a_agreement.pdf",
      "page": 4,
      "quote": "The agreement automatically renews for 24 months at a 14% higher unit price.",
      "locatorBbox": null,
      "extractedField": "renewal_term_months",
      "extractedValue": "24 months",
      "matchMethod": "exact",
      "matchScore": 1.0,
      "quoteMatched": true
    },
    {
      "id": "EV-021",
      "sourceFile": "supplier_a_agreement.pdf",
      "page": 4,
      "quote": "The agreement automatically renews for 24 months at a 14% higher unit price.",
      "locatorBbox": null,
      "extractedField": "renewal_price_increase_pct",
      "extractedValue": "14%",
      "matchMethod": "exact",
      "matchScore": 1.0,
      "quoteMatched": true
    },
    {
      "id": "EV-024",
      "sourceFile": "supplier_a_agreement.pdf",
      "page": 4,
      "quote": "The renewed term has a minimum purchase commitment equal to 60% of forecast demand.",
      "locatorBbox": null,
      "extractedField": "min_purchase_share_A",
      "extractedValue": "60%",
      "matchMethod": "exact",
      "matchScore": 1.0,
      "quoteMatched": true
    },
    {
      "id": "EV-027",
      "sourceFile": "supplier_a_agreement.pdf",
      "page": 4,
      "quote": "Early exit during the renewed term incurs a fixed termination fee of $25,000.",
      "locatorBbox": null,
      "extractedField": "termination_fee",
      "extractedValue": "$25,000",
      "matchMethod": "exact",
      "matchScore": 1.0,
      "quoteMatched": true
    }
  ],
  "contract": {
    "decisionDate": "2026-10-04",
    "renewalDate": "2026-11-18",
    "daysToRenewal": 45,
    "renewalNoticeDays": 60,
    "noticeDeadline": "2026-09-19",
    "noticeSent": false,
    "noticeRecordSource": "supplier_correspondence_log.csv — no written notice entry before 2026-09-19 (mock input)",
    "renewalLocked": true,
    "renewalTermMonths": 24,
    "renewalPriceIncreasePct": 0.14,
    "minPurchaseShareA": 0.6,
    "forecastBasis": "locked-at-renewal",
    "lockedForecastUnits24m": 26000,
    "minPurchaseUnitsA": 15600,
    "terminationFeeUsd": 25000,
    "evidenceIds": [
      "EV-014",
      "EV-019",
      "EV-021",
      "EV-024",
      "EV-027"
    ]
  },
  "variables": [
    {
      "key": "renewal_locked",
      "name": "Renewal locked-in",
      "value": "Yes",
      "unit": "boolean",
      "source": "EV-014",
      "meaning": "The notice deadline passed with no written notice on record, so the agreement renews.",
      "inputs": [
        {
          "name": "decision_date",
          "value": "2026-10-04",
          "source": "contract.decisionDate"
        },
        {
          "name": "renewal_date",
          "value": "2026-11-18",
          "source": "contract.renewalDate"
        },
        {
          "name": "days_to_renewal",
          "value": "45 days",
          "source": "derived"
        },
        {
          "name": "renewal_notice_days",
          "value": "60 days",
          "source": "EV-014"
        },
        {
          "name": "notice_sent_before_deadline",
          "value": "No",
          "source": "contract.noticeRecordSource"
        }
      ]
    },
    {
      "key": "renewal_term_months",
      "name": "Renewal term",
      "value": "24 months",
      "unit": "months",
      "source": "EV-019",
      "meaning": "The price uplift and the minimum commitment persist for the whole simulated horizon.",
      "inputs": [
        {
          "name": "renewal_term_months",
          "value": "24",
          "source": "EV-019"
        },
        {
          "name": "simulation_weeks",
          "value": "104",
          "source": "simulation.weeks"
        }
      ]
    },
    {
      "key": "effective_price_A",
      "name": "Effective price A",
      "value": "Base × 1.14",
      "unit": "USD per unit",
      "source": "EV-021",
      "meaning": "Purchase cost is booked at base price; the {{evidence:EV-021}} uplift is reported separately as renewal premium.",
      "inputs": [
        {
          "name": "base_price_A",
          "value": "$12.00",
          "source": "supplier_delivery_history.xlsx"
        },
        {
          "name": "renewal_price_increase_pct",
          "value": "14%",
          "source": "EV-021"
        }
      ]
    },
    {
      "key": "min_purchase_share_A",
      "name": "Minimum share A",
      "value": "60% of locked forecast",
      "unit": "share",
      "source": "EV-024",
      "meaning": "{{contract:minPurchaseUnitsA}} must still be bought from A even if demand falls; D1 stays feasible, D2 pays the exit fee.",
      "inputs": [
        {
          "name": "min_purchase_share_A",
          "value": "60%",
          "source": "EV-024"
        },
        {
          "name": "forecast_basis",
          "value": "locked at renewal",
          "source": "contract.forecastBasis"
        },
        {
          "name": "locked_forecast_units_24m",
          "value": "26,000 units",
          "source": "synthetic renewal-cycle forecast assumption; supplier_a_agreement.pdf p. 4 (not a sum of historical demand)"
        }
      ]
    },
    {
      "key": "termination_fee",
      "name": "Exit cost",
      "value": "$25,000",
      "unit": "USD",
      "source": "EV-027",
      "meaning": "Charged once when the renewed agreement is terminated (D2 only).",
      "inputs": [
        {
          "name": "termination_fee",
          "value": "$25,000",
          "source": "EV-027"
        },
        {
          "name": "renewal_locked",
          "value": "Yes",
          "source": "variables.renewal_locked"
        }
      ]
    }
  ],
  "scenarios": [
    {
      "id": "baseline",
      "label": "Baseline",
      "tag": "Reference case",
      "demandShock": 0,
      "demandUnits24m": 26000,
      "leadTime": "Normal",
      "leadTimeMultiplier": 1.0,
      "description": "Expected demand and normal supplier lead-time variability."
    },
    {
      "id": "demand-drop",
      "label": "Demand −15%",
      "tag": "Cash stress",
      "demandShock": -15,
      "demandUnits24m": 22100,
      "leadTime": "Normal",
      "leadTimeMultiplier": 1.0,
      "description": "Demand contracts while the minimum purchase commitment remains active."
    },
    {
      "id": "lead-stress",
      "label": "Lead-time stress",
      "tag": "Service risk",
      "demandShock": 0,
      "demandUnits24m": 26000,
      "leadTime": "+30% variability",
      "leadTimeMultiplier": 1.3,
      "description": "Supplier A delivery variability rises under logistics pressure."
    }
  ],
  "options": [
    {
      "id": "D0",
      "label": "Keep A",
      "shareA": 1.0,
      "terminateA": false,
      "allocation": "100% A · 0% B",
      "short": "100% A",
      "description": "Preserve the current supplier allocation."
    },
    {
      "id": "D1",
      "label": "Minimum A + Diversify B",
      "shareA": 0.6,
      "terminateA": false,
      "allocation": "60% A · 40% B",
      "short": "60% A / 40% B",
      "description": "Respect the locked minimum while reducing concentration."
    },
    {
      "id": "D2",
      "label": "Exit A + Move to B",
      "shareA": 0.0,
      "terminateA": true,
      "allocation": "0% A · 100% B",
      "short": "Exit A / 100% B",
      "description": "Exit the renewed agreement and include the contract fee."
    }
  ],
  "simulation": {
    "simulationId": "sim-day1-mock-0001",
    "seed": 1042026,
    "dataVersion": "demo-2026.10.04-v4",
    "formulaVersion": "tco-v1",
    "weeks": 104,
    "monteCarloRuns": 0,
    "matrix": {
      "baseline": [
        {
          "optionId": "D0",
          "feasible": true,
          "expectedTco": 420000,
          "stockoutProbability": 0.09,
          "serviceLevel": 0.968,
          "cashOutflowP90": 451000,
          "breakdown": {